,number,value,datetime_start,datetime_complete,duration,params_activation_fn,params_batch_size,params_clip_range,params_ent_coef,params_gae_lambda,params_gamma,params_learning_rate,params_max_grad_norm,params_n_epochs,params_n_steps,params_net_arch,params_vf_coef,state
0,0,-2.0,2022-03-04 15:30:27.343229,2022-03-04 15:32:41.924649,0 days 00:02:14.581420,tanh,256,0.4,0.00013049265937327368,0.9,0.999,2.9294753921188484e-05,0.3,5,512,medium,0.8518519451426094,COMPLETE
1,1,-2.0,2022-03-04 15:30:27.343229,2022-03-04 15:32:34.907441,0 days 00:02:07.564212,tanh,512,0.2,0.0006241889118912564,0.98,0.9999,0.0002603841892037418,5.0,5,128,small,0.30031258164680374,COMPLETE
2,2,0.0,2022-03-04 15:30:27.343229,2022-03-04 15:34:33.027608,0 days 00:04:05.684379,relu,64,0.1,0.0009937824677580698,0.98,0.999,2.7309107780267007e-05,0.3,20,64,small,0.23993234991314627,COMPLETE
3,3,-8006.666666666667,2022-03-04 15:32:34.907441,2022-03-04 15:46:47.863186,0 days 00:14:12.955745,relu,32,0.2,0.0006179273878386352,0.8,0.999,0.0006496968074292791,2.0,20,64,medium,0.8849878043859328,PRUNED
4,4,-95988.66666666667,2022-03-04 15:32:41.927649,2022-03-04 15:52:31.967624,0 days 00:19:50.039975,relu,512,0.4,0.002395040412658656,0.8,0.9,8.801163059151731e-05,0.3,20,128,medium,0.5425591171817717,PRUNED
5,5,11.333333333333334,2022-03-04 15:34:33.027608,2022-03-04 15:36:58.534218,0 days 00:02:25.506610,tanh,512,0.2,0.007289320488957384,1.0,0.999,5.189689698498885e-05,0.5,10,128,medium,0.5171380183170422,COMPLETE
6,6,4.333333333333333,2022-03-04 15:36:58.549844,2022-03-04 15:39:48.398976,0 days 00:02:49.849132,relu,512,0.3,0.0016544364296661146,0.92,0.999,0.00025039645092703866,1.0,10,128,medium,0.7912768536592875,COMPLETE
7,7,0.3333333333333333,2022-03-04 15:39:48.398976,2022-03-04 15:40:43.297840,0 days 00:00:54.898864,tanh,128,0.2,0.009420093295337746,1.0,0.95,0.0009852728861140367,0.5,1,256,medium,0.5582836889841845,PRUNED
8,8,12.0,2022-03-04 15:40:43.297840,2022-03-04 15:45:27.399271,0 days 00:04:44.101431,tanh,32,0.2,0.005727640931541903,0.99,0.99,1.1399404853515552e-05,0.7,10,1024,medium,0.0038542070884031165,COMPLETE
9,9,1.3333333333333333,2022-03-05 14:52:11.849359,2022-03-05 14:53:12.774974,0 days 00:01:00.925615,,32,0.3,0.003584533675835652,0.99,0.99,1.1463995259887874e-05,0.7,10,1024,,0.0038600046927892836,PRUNED
10,10,-5.0,2022-03-05 14:53:12.774974,2022-03-05 14:53:45.868725,0 days 00:00:33.093751,,32,0.1,0.00019844672086407087,0.99,0.99,1.0821028524082244e-05,0.7,1,1024,,0.003791694975211257,PRUNED
11,11,5.333333333333333,2022-03-05 14:53:45.868725,2022-03-05 14:55:09.423035,0 days 00:01:23.554310,,128,0.2,0.009272500283255792,0.95,0.995,4.622584456593003e-05,0.5,10,2048,,0.3270329045487483,COMPLETE
12,12,9.333333333333334,2022-03-05 14:55:09.423035,2022-03-05 14:56:25.279430,0 days 00:01:15.856395,,256,0.2,0.004500884237636521,1.0,0.99,7.989247867482816e-05,0.9,10,1024,,0.6817606380705563,COMPLETE
13,13,0.6666666666666666,2022-03-05 14:56:25.279430,2022-03-05 14:56:58.624386,0 days 00:00:33.344956,,512,0.2,0.005072073727298803,1.0,0.95,2.0934792984077186e-05,0.5,10,2048,,0.4438528407151209,PRUNED
14,14,-2.3333333333333335,2022-03-05 14:56:58.624386,2022-03-05 14:57:47.642584,0 days 00:00:49.018198,,64,0.2,0.006013989693459781,0.99,0.9999,0.0001886848858419879,0.7,10,512,,0.183581377693048,PRUNED
15,15,4.333333333333333,2022-03-05 14:57:47.642584,2022-03-05 14:58:51.734493,0 days 00:01:04.091909,,32,0.2,0.002409564180086448,0.95,0.9,5.116754594432362e-05,0.9,10,256,,0.6815950090702323,PRUNED
16,16,9.666666666666666,2022-03-05 14:58:51.734493,2022-03-05 15:00:14.381132,0 days 00:01:22.646639,,512,0.1,0.00978437988379956,0.9,0.995,1.6693244304867695e-05,1.0,10,128,,0.9909491747661614,COMPLETE
17,17,1.0,2022-03-05 15:00:14.381132,2022-03-05 15:01:00.319829,0 days 00:00:45.938697,,32,0.3,0.001366960540074655,0.92,0.99,0.00015225991671413588,2.0,5,1024,,0.42609100813914524,PRUNED
18,18,4.666666666666667,2022-03-05 15:01:00.319829,2022-03-05 15:01:30.666054,0 days 00:00:30.346225,,128,0.4,0.003111393353642023,1.0,0.999,3.840821091791025e-05,5.0,1,128,,0.12483923559130457,PRUNED
19,19,5.333333333333333,2022-03-05 15:01:30.666054,2022-03-05 15:02:17.824799,0 days 00:00:47.158745,,64,0.2,0.00029778388322690847,0.99,0.99,1.6575902604897667e-05,0.7,10,1024,,0.6350068854255386,PRUNED
20,20,-1.0,2022-03-05 15:02:17.824799,2022-03-05 15:03:07.547060,0 days 00:00:49.722261,,256,0.2,0.005790608080899899,1.0,0.95,6.62691019064315e-05,0.5,10,64,,0.4064277638253403,PRUNED
21,21,-3.0,2022-03-05 15:03:07.547060,2022-03-05 15:03:48.532672,0 days 00:00:40.985612,,512,0.1,0.009714780742213706,0.9,0.995,1.676774927389882e-05,1.0,10,128,,0.9459025420070153,PRUNED
22,22,5.666666666666667,2022-03-05 15:03:48.532672,2022-03-05 15:04:30.301197,0 days 00:00:41.768525,,512,0.1,0.006664854940015337,0.9,0.995,1.0198870213357631e-05,1.0,10,128,,0.7884220806490165,PRUNED
23,23,0.3333333333333333,2022-03-05 15:04:30.301197,2022-03-05 15:05:10.789018,0 days 00:00:40.487821,,512,0.1,0.003592730558733116,0.9,0.995,2.2368672228894633e-05,1.0,10,128,,0.12338902708500593,PRUNED
24,24,0.0,2022-03-05 15:05:10.789018,2022-03-05 15:05:52.525607,0 days 00:00:41.736589,,512,0.1,0.007137916932101372,0.99,0.995,1.5538011018324798e-05,1.0,10,128,,0.6221391534199561,PRUNED
25,25,1.6666666666666667,2022-03-05 15:05:52.525607,2022-03-05 15:06:55.293686,0 days 00:01:02.768079,,32,0.1,0.002324292404543027,0.9,0.9,3.298368705056125e-05,0.7,10,256,,0.773082831609006,PRUNED
26,26,-2.0,2022-03-05 15:06:55.293686,2022-03-05 15:07:27.297154,0 days 00:00:32.003468,,512,0.4,0.004427933811291996,0.8,0.9999,0.00013896062998743102,0.5,5,2048,,0.34353692726836454,PRUNED
27,27,7.0,2022-03-05 15:12:50.664109,2022-03-05 15:13:21.191416,0 days 00:00:30.527307,,512,0.3,0.007164496556664123,0.95,0.999,5.9178639439402796e-05,2.0,1,512,,0.9896762877902308,PRUNED
28,28,-2.0,2022-03-05 15:13:21.191416,2022-03-05 15:14:55.259339,0 days 00:01:34.067923,,32,0.2,0.003173007003546491,0.98,0.99,1.3953538118719814e-05,0.9,20,1024,,0.49571636399305236,PRUNED
29,29,-4.0,2022-03-05 15:14:55.259339,2022-03-05 15:15:28.182524,0 days 00:00:32.923185,,256,0.4,0.009984218401814198,0.9,0.995,2.7621981167696452e-05,5.0,5,512,,0.8772547336668675,PRUNED
30,30,-3.3333333333333335,2022-03-05 15:15:28.182524,2022-03-05 15:16:17.045345,0 days 00:00:48.862821,,64,0.1,0.0013245594665939394,0.92,0.999,2.1016743776077454e-05,0.3,10,128,,0.07972603118613963,PRUNED
31,31,3.6666666666666665,2022-03-05 15:16:17.045345,2022-03-05 15:16:53.343432,0 days 00:00:36.298087,,256,0.2,0.004741743024549404,1.0,0.99,8.685066655917504e-05,0.9,10,1024,,0.688675502698924,PRUNED
32,32,1.3333333333333333,2022-03-05 15:16:53.343432,2022-03-05 15:17:29.986536,0 days 00:00:36.643104,,256,0.2,0.004363444122714756,1.0,0.99,0.00011210155809807968,0.9,10,1024,,0.7248470325125256,PRUNED
33,33,4.666666666666667,2022-03-05 15:17:29.986536,2022-03-05 15:18:05.880632,0 days 00:00:35.894096,,256,0.2,0.007604481494104319,1.0,0.99,6.851645602276125e-05,0.9,10,1024,,0.6019797436392833,PRUNED
34,34,-0.3333333333333333,2022-03-05 15:18:05.880632,2022-03-05 15:19:20.196878,0 days 00:01:14.316246,,256,0.2,0.000554617644583019,0.98,0.99,0.00032906085130557546,0.9,10,1024,,0.2814237306850028,COMPLETE
35,35,6.333333333333333,2022-03-05 15:19:20.196878,2022-03-05 15:20:11.902502,0 days 00:00:51.705624,,512,0.2,0.005261588965310777,1.0,0.9999,3.905964620110693e-05,0.7,20,128,,0.5000199474711782,PRUNED
36,36,11.333333333333334,2022-03-05 15:20:11.902502,2022-03-05 15:21:30.530997,0 days 00:01:18.628495,,256,0.2,0.0008126485560092345,0.99,0.999,2.5274988389033615e-05,0.3,5,64,,0.9303764837204974,COMPLETE
37,37,3.0,2022-03-05 15:35:34.023174,2022-03-05 15:36:16.587841,0 days 00:00:42.564667,,128,0.2,0.0005061831917778822,0.99,0.999,1.994778162272178e-05,1.0,5,64,,0.920001714716462,PRUNED
38,38,3.0,2022-03-05 15:36:16.588840,2022-03-05 15:36:57.297304,0 days 00:00:40.708464,,512,0.3,0.00045073844071891216,0.99,0.999,2.7412725259482703e-05,0.3,5,64,,0.9788487584912912,PRUNED
39,39,7.333333333333333,2022-03-05 15:36:57.298304,2022-03-05 15:37:45.820346,0 days 00:00:48.522042,,32,0.1,0.0008672967851299183,0.99,0.999,1.2750691359639383e-05,0.3,5,64,,0.8886142536723411,PRUNED
40,40,6.666666666666667,2022-03-05 15:37:45.820346,2022-03-05 15:38:25.254491,0 days 00:00:39.434145,,512,0.4,0.0007587461390709733,0.8,0.999,3.288984940793391e-05,0.3,5,64,,0.8162735156092473,PRUNED
41,41,8.0,2022-03-05 15:38:25.254491,2022-03-05 15:39:17.561507,0 days 00:00:52.307016,,256,0.2,0.00036770508681032327,0.99,0.999,7.842974691371686e-05,0.5,20,128,,0.8374187993479121,PRUNED
42,42,6.666666666666667,2022-03-05 15:39:17.561507,2022-03-05 15:39:54.556742,0 days 00:00:36.995235,,256,0.2,0.0020173740131796862,1.0,0.9,4.487985934415854e-05,0.3,10,1024,,0.7413700660776118,PRUNED
43,43,3.6666666666666665,2022-03-05 15:39:54.556742,2022-03-05 15:40:59.263169,0 days 00:01:04.706427,,256,0.2,0.00014230283412997732,0.9,0.95,2.3742727459754457e-05,5.0,1,64,,0.54322800922636,COMPLETE
44,44,3.0,2022-03-05 15:40:59.278794,2022-03-05 15:41:37.473020,0 days 00:00:38.194226,,256,0.2,0.0011081239011318646,0.98,0.99,0.00011255379114829522,0.5,10,256,,0.9019764137337758,PRUNED
45,45,6.666666666666667,2022-03-05 15:41:37.473020,2022-03-05 15:42:20.977247,0 days 00:00:43.504227,,32,0.2,0.008058948610877638,0.99,0.999,1.2568454611639131e-05,0.7,5,2048,,0.23296731107106233,PRUNED
46,46,4.666666666666667,2022-03-05 15:42:20.977247,2022-03-05 15:43:03.082978,0 days 00:00:42.105731,,128,0.2,0.0007550140948413672,0.92,0.995,0.00040694663844984637,2.0,10,128,,0.9592005080054095,PRUNED
47,47,5.333333333333333,2022-03-05 15:43:03.082978,2022-03-05 15:44:42.540741,0 days 00:01:39.457763,,64,0.2,0.003755861629389845,1.0,0.99,5.601294789974536e-05,1.0,10,1024,,0.3767501398506927,COMPLETE
48,48,3.0,2022-03-05 15:44:42.540741,2022-03-05 15:45:13.256487,0 days 00:00:30.715746,,256,0.3,0.006170391550344731,0.95,0.9999,1.7526389820702103e-05,0.3,1,512,,0.5050762057258292,PRUNED
49,49,-3.3333333333333335,2022-03-05 15:45:13.256487,2022-03-05 15:48:36.878943,0 days 00:03:23.622456,,32,0.2,0.008243361557520677,0.8,0.95,4.067006041078501e-05,0.7,20,128,,0.8470717455020672,COMPLETE
50,50,-2.6666666666666665,2022-03-05 15:48:36.880944,2022-03-05 15:49:11.768554,0 days 00:00:34.887610,,512,0.1,0.0017505944794313152,0.99,0.99,3.297001219597509e-05,0.5,10,1024,,0.6631870664346289,PRUNED
51,51,2.6666666666666665,2022-03-05 15:49:11.768554,2022-03-05 15:49:59.682537,0 days 00:00:47.913983,,64,0.2,0.00363071816500337,1.0,0.99,5.035519660445456e-05,1.0,10,1024,,0.3732664222105597,PRUNED
52,52,4.666666666666667,2022-03-05 15:49:59.682537,2022-03-05 15:50:38.964501,0 days 00:00:39.281964,,128,0.2,0.008395776274905297,0.95,0.995,7.564575822170757e-05,0.5,10,2048,,0.05823410264382957,PRUNED
