,number,value,datetime_start,datetime_complete,duration,params_activation_fn,params_batch_size,params_clip_range,params_ent_coef,params_gae_lambda,params_gamma,params_learning_rate,params_max_grad_norm,params_n_epochs,params_n_steps,params_net_arch,params_vf_coef,state
0,0,-2.0,2022-03-04 15:30:27.343229,2022-03-04 15:32:41.924649,0 days 00:02:14.581420,tanh,256,0.4,0.00013049265937327368,0.9,0.999,2.9294753921188484e-05,0.3,5,512,medium,0.8518519451426094,COMPLETE
1,1,-2.0,2022-03-04 15:30:27.343229,2022-03-04 15:32:34.907441,0 days 00:02:07.564212,tanh,512,0.2,0.0006241889118912564,0.98,0.9999,0.0002603841892037418,5.0,5,128,small,0.30031258164680374,COMPLETE
2,2,0.0,2022-03-04 15:30:27.343229,2022-03-04 15:34:33.027608,0 days 00:04:05.684379,relu,64,0.1,0.0009937824677580698,0.98,0.999,2.7309107780267007e-05,0.3,20,64,small,0.23993234991314627,COMPLETE
3,3,-8006.666666666667,2022-03-04 15:32:34.907441,2022-03-04 15:46:47.863186,0 days 00:14:12.955745,relu,32,0.2,0.0006179273878386352,0.8,0.999,0.0006496968074292791,2.0,20,64,medium,0.8849878043859328,PRUNED
4,4,-95988.66666666667,2022-03-04 15:32:41.927649,2022-03-04 15:52:31.967624,0 days 00:19:50.039975,relu,512,0.4,0.002395040412658656,0.8,0.9,8.801163059151731e-05,0.3,20,128,medium,0.5425591171817717,PRUNED
5,5,11.333333333333334,2022-03-04 15:34:33.027608,2022-03-04 15:36:58.534218,0 days 00:02:25.506610,tanh,512,0.2,0.007289320488957384,1.0,0.999,5.189689698498885e-05,0.5,10,128,medium,0.5171380183170422,COMPLETE
6,6,4.333333333333333,2022-03-04 15:36:58.549844,2022-03-04 15:39:48.398976,0 days 00:02:49.849132,relu,512,0.3,0.0016544364296661146,0.92,0.999,0.00025039645092703866,1.0,10,128,medium,0.7912768536592875,COMPLETE
7,7,0.3333333333333333,2022-03-04 15:39:48.398976,2022-03-04 15:40:43.297840,0 days 00:00:54.898864,tanh,128,0.2,0.009420093295337746,1.0,0.95,0.0009852728861140367,0.5,1,256,medium,0.5582836889841845,PRUNED
8,8,12.0,2022-03-04 15:40:43.297840,2022-03-04 15:45:27.399271,0 days 00:04:44.101431,tanh,32,0.2,0.005727640931541903,0.99,0.99,1.1399404853515552e-05,0.7,10,1024,medium,0.0038542070884031165,COMPLETE
9,9,1.3333333333333333,2022-03-05 14:52:11.849359,2022-03-05 14:53:12.774974,0 days 00:01:00.925615,,32,0.3,0.003584533675835652,0.99,0.99,1.1463995259887874e-05,0.7,10,1024,,0.0038600046927892836,PRUNED
10,10,-5.0,2022-03-05 14:53:12.774974,2022-03-05 14:53:45.868725,0 days 00:00:33.093751,,32,0.1,0.00019844672086407087,0.99,0.99,1.0821028524082244e-05,0.7,1,1024,,0.003791694975211257,PRUNED
11,11,5.333333333333333,2022-03-05 14:53:45.868725,2022-03-05 14:55:09.423035,0 days 00:01:23.554310,,128,0.2,0.009272500283255792,0.95,0.995,4.622584456593003e-05,0.5,10,2048,,0.3270329045487483,COMPLETE
12,12,9.333333333333334,2022-03-05 14:55:09.423035,2022-03-05 14:56:25.279430,0 days 00:01:15.856395,,256,0.2,0.004500884237636521,1.0,0.99,7.989247867482816e-05,0.9,10,1024,,0.6817606380705563,COMPLETE
13,13,0.6666666666666666,2022-03-05 14:56:25.279430,2022-03-05 14:56:58.624386,0 days 00:00:33.344956,,512,0.2,0.005072073727298803,1.0,0.95,2.0934792984077186e-05,0.5,10,2048,,0.4438528407151209,PRUNED
14,14,-2.3333333333333335,2022-03-05 14:56:58.624386,2022-03-05 14:57:47.642584,0 days 00:00:49.018198,,64,0.2,0.006013989693459781,0.99,0.9999,0.0001886848858419879,0.7,10,512,,0.183581377693048,PRUNED
15,15,4.333333333333333,2022-03-05 14:57:47.642584,2022-03-05 14:58:51.734493,0 days 00:01:04.091909,,32,0.2,0.002409564180086448,0.95,0.9,5.116754594432362e-05,0.9,10,256,,0.6815950090702323,PRUNED
16,16,9.666666666666666,2022-03-05 14:58:51.734493,2022-03-05 15:00:14.381132,0 days 00:01:22.646639,,512,0.1,0.00978437988379956,0.9,0.995,1.6693244304867695e-05,1.0,10,128,,0.9909491747661614,COMPLETE
17,17,1.0,2022-03-05 15:00:14.381132,2022-03-05 15:01:00.319829,0 days 00:00:45.938697,,32,0.3,0.001366960540074655,0.92,0.99,0.00015225991671413588,2.0,5,1024,,0.42609100813914524,PRUNED
18,18,4.666666666666667,2022-03-05 15:01:00.319829,2022-03-05 15:01:30.666054,0 days 00:00:30.346225,,128,0.4,0.003111393353642023,1.0,0.999,3.840821091791025e-05,5.0,1,128,,0.12483923559130457,PRUNED
19,19,5.333333333333333,2022-03-05 15:01:30.666054,2022-03-05 15:02:17.824799,0 days 00:00:47.158745,,64,0.2,0.00029778388322690847,0.99,0.99,1.6575902604897667e-05,0.7,10,1024,,0.6350068854255386,PRUNED
20,20,-1.0,2022-03-05 15:02:17.824799,2022-03-05 15:03:07.547060,0 days 00:00:49.722261,,256,0.2,0.005790608080899899,1.0,0.95,6.62691019064315e-05,0.5,10,64,,0.4064277638253403,PRUNED
21,21,-3.0,2022-03-05 15:03:07.547060,2022-03-05 15:03:48.532672,0 days 00:00:40.985612,,512,0.1,0.009714780742213706,0.9,0.995,1.676774927389882e-05,1.0,10,128,,0.9459025420070153,PRUNED
22,22,5.666666666666667,2022-03-05 15:03:48.532672,2022-03-05 15:04:30.301197,0 days 00:00:41.768525,,512,0.1,0.006664854940015337,0.9,0.995,1.0198870213357631e-05,1.0,10,128,,0.7884220806490165,PRUNED
23,23,0.3333333333333333,2022-03-05 15:04:30.301197,2022-03-05 15:05:10.789018,0 days 00:00:40.487821,,512,0.1,0.003592730558733116,0.9,0.995,2.2368672228894633e-05,1.0,10,128,,0.12338902708500593,PRUNED
24,24,0.0,2022-03-05 15:05:10.789018,2022-03-05 15:05:52.525607,0 days 00:00:41.736589,,512,0.1,0.007137916932101372,0.99,0.995,1.5538011018324798e-05,1.0,10,128,,0.6221391534199561,PRUNED
25,25,1.6666666666666667,2022-03-05 15:05:52.525607,2022-03-05 15:06:55.293686,0 days 00:01:02.768079,,32,0.1,0.002324292404543027,0.9,0.9,3.298368705056125e-05,0.7,10,256,,0.773082831609006,PRUNED
26,26,-2.0,2022-03-05 15:06:55.293686,2022-03-05 15:07:27.297154,0 days 00:00:32.003468,,512,0.4,0.004427933811291996,0.8,0.9999,0.00013896062998743102,0.5,5,2048,,0.34353692726836454,PRUNED
27,27,7.0,2022-03-05 15:12:50.664109,2022-03-05 15:13:21.191416,0 days 00:00:30.527307,,512,0.3,0.007164496556664123,0.95,0.999,5.9178639439402796e-05,2.0,1,512,,0.9896762877902308,PRUNED
28,28,-2.0,2022-03-05 15:13:21.191416,2022-03-05 15:14:55.259339,0 days 00:01:34.067923,,32,0.2,0.003173007003546491,0.98,0.99,1.3953538118719814e-05,0.9,20,1024,,0.49571636399305236,PRUNED
29,29,-4.0,2022-03-05 15:14:55.259339,2022-03-05 15:15:28.182524,0 days 00:00:32.923185,,256,0.4,0.009984218401814198,0.9,0.995,2.7621981167696452e-05,5.0,5,512,,0.8772547336668675,PRUNED
30,30,-3.3333333333333335,2022-03-05 15:15:28.182524,2022-03-05 15:16:17.045345,0 days 00:00:48.862821,,64,0.1,0.0013245594665939394,0.92,0.999,2.1016743776077454e-05,0.3,10,128,,0.07972603118613963,PRUNED
31,31,3.6666666666666665,2022-03-05 15:16:17.045345,2022-03-05 15:16:53.343432,0 days 00:00:36.298087,,256,0.2,0.004741743024549404,1.0,0.99,8.685066655917504e-05,0.9,10,1024,,0.688675502698924,PRUNED
32,32,1.3333333333333333,2022-03-05 15:16:53.343432,2022-03-05 15:17:29.986536,0 days 00:00:36.643104,,256,0.2,0.004363444122714756,1.0,0.99,0.00011210155809807968,0.9,10,1024,,0.7248470325125256,PRUNED
33,33,4.666666666666667,2022-03-05 15:17:29.986536,2022-03-05 15:18:05.880632,0 days 00:00:35.894096,,256,0.2,0.007604481494104319,1.0,0.99,6.851645602276125e-05,0.9,10,1024,,0.6019797436392833,PRUNED
34,34,-0.3333333333333333,2022-03-05 15:18:05.880632,2022-03-05 15:19:20.196878,0 days 00:01:14.316246,,256,0.2,0.000554617644583019,0.98,0.99,0.00032906085130557546,0.9,10,1024,,0.2814237306850028,COMPLETE
35,35,6.333333333333333,2022-03-05 15:19:20.196878,2022-03-05 15:20:11.902502,0 days 00:00:51.705624,,512,0.2,0.005261588965310777,1.0,0.9999,3.905964620110693e-05,0.7,20,128,,0.5000199474711782,PRUNED
36,36,11.333333333333334,2022-03-05 15:20:11.902502,2022-03-05 15:21:30.530997,0 days 00:01:18.628495,,256,0.2,0.0008126485560092345,0.99,0.999,2.5274988389033615e-05,0.3,5,64,,0.9303764837204974,COMPLETE
37,37,3.0,2022-03-05 15:35:34.023174,2022-03-05 15:36:16.587841,0 days 00:00:42.564667,,128,0.2,0.0005061831917778822,0.99,0.999,1.994778162272178e-05,1.0,5,64,,0.920001714716462,PRUNED
38,38,3.0,2022-03-05 15:36:16.588840,2022-03-05 15:36:57.297304,0 days 00:00:40.708464,,512,0.3,0.00045073844071891216,0.99,0.999,2.7412725259482703e-05,0.3,5,64,,0.9788487584912912,PRUNED
39,39,7.333333333333333,2022-03-05 15:36:57.298304,2022-03-05 15:37:45.820346,0 days 00:00:48.522042,,32,0.1,0.0008672967851299183,0.99,0.999,1.2750691359639383e-05,0.3,5,64,,0.8886142536723411,PRUNED
40,40,6.666666666666667,2022-03-05 15:37:45.820346,2022-03-05 15:38:25.254491,0 days 00:00:39.434145,,512,0.4,0.0007587461390709733,0.8,0.999,3.288984940793391e-05,0.3,5,64,,0.8162735156092473,PRUNED
41,41,8.0,2022-03-05 15:38:25.254491,2022-03-05 15:39:17.561507,0 days 00:00:52.307016,,256,0.2,0.00036770508681032327,0.99,0.999,7.842974691371686e-05,0.5,20,128,,0.8374187993479121,PRUNED
42,42,6.666666666666667,2022-03-05 15:39:17.561507,2022-03-05 15:39:54.556742,0 days 00:00:36.995235,,256,0.2,0.0020173740131796862,1.0,0.9,4.487985934415854e-05,0.3,10,1024,,0.7413700660776118,PRUNED
43,43,3.6666666666666665,2022-03-05 15:39:54.556742,2022-03-05 15:40:59.263169,0 days 00:01:04.706427,,256,0.2,0.00014230283412997732,0.9,0.95,2.3742727459754457e-05,5.0,1,64,,0.54322800922636,COMPLETE
44,44,3.0,2022-03-05 15:40:59.278794,2022-03-05 15:41:37.473020,0 days 00:00:38.194226,,256,0.2,0.0011081239011318646,0.98,0.99,0.00011255379114829522,0.5,10,256,,0.9019764137337758,PRUNED
45,45,6.666666666666667,2022-03-05 15:41:37.473020,2022-03-05 15:42:20.977247,0 days 00:00:43.504227,,32,0.2,0.008058948610877638,0.99,0.999,1.2568454611639131e-05,0.7,5,2048,,0.23296731107106233,PRUNED
46,46,4.666666666666667,2022-03-05 15:42:20.977247,2022-03-05 15:43:03.082978,0 days 00:00:42.105731,,128,0.2,0.0007550140948413672,0.92,0.995,0.00040694663844984637,2.0,10,128,,0.9592005080054095,PRUNED
47,47,5.333333333333333,2022-03-05 15:43:03.082978,2022-03-05 15:44:42.540741,0 days 00:01:39.457763,,64,0.2,0.003755861629389845,1.0,0.99,5.601294789974536e-05,1.0,10,1024,,0.3767501398506927,COMPLETE
48,48,3.0,2022-03-05 15:44:42.540741,2022-03-05 15:45:13.256487,0 days 00:00:30.715746,,256,0.3,0.006170391550344731,0.95,0.9999,1.7526389820702103e-05,0.3,1,512,,0.5050762057258292,PRUNED
49,49,-3.3333333333333335,2022-03-05 15:45:13.256487,2022-03-05 15:48:36.878943,0 days 00:03:23.622456,,32,0.2,0.008243361557520677,0.8,0.95,4.067006041078501e-05,0.7,20,128,,0.8470717455020672,COMPLETE
50,50,-2.6666666666666665,2022-03-05 15:48:36.880944,2022-03-05 15:49:11.768554,0 days 00:00:34.887610,,512,0.1,0.0017505944794313152,0.99,0.99,3.297001219597509e-05,0.5,10,1024,,0.6631870664346289,PRUNED
51,51,2.6666666666666665,2022-03-05 15:49:11.768554,2022-03-05 15:49:59.682537,0 days 00:00:47.913983,,64,0.2,0.00363071816500337,1.0,0.99,5.035519660445456e-05,1.0,10,1024,,0.3732664222105597,PRUNED
52,52,4.666666666666667,2022-03-05 15:49:59.682537,2022-03-05 15:50:38.964501,0 days 00:00:39.281964,,128,0.2,0.008395776274905297,0.95,0.995,7.564575822170757e-05,0.5,10,2048,,0.05823410264382957,PRUNED
53,53,4.666666666666667,2022-03-07 15:22:11.577736,2022-03-07 15:22:47.671213,0 days 00:00:36.093477,,128,0.2,0.005439301982890643,0.95,0.995,2.4974590744408118e-05,0.5,10,2048,,0.5902299509357524,PRUNED
54,54,2.6666666666666665,2022-03-07 15:22:47.671213,2022-03-07 15:23:23.724787,0 days 00:00:36.053574,,128,0.2,0.006621312485627631,0.95,0.995,4.642015377556071e-05,0.5,10,2048,,0.16988117705072886,PRUNED
55,55,3.3333333333333335,2022-03-07 15:23:23.724787,2022-03-07 15:23:53.851473,0 days 00:00:30.126686,,128,0.2,0.009659130385469549,0.9,0.995,1.8757846863859847e-05,0.5,10,2048,,0.74205166258153,PRUNED
56,56,0.6666666666666666,2022-03-07 15:23:53.851473,2022-03-07 15:24:22.394904,0 days 00:00:28.543431,,512,0.1,0.005877838460812505,0.95,0.9,1.1404958926232722e-05,0.9,10,128,,0.309616491051884,PRUNED
57,57,9.666666666666666,2022-03-07 15:24:22.394904,2022-03-07 15:24:55.626723,0 days 00:00:33.231819,,64,0.4,0.0027130165584011213,1.0,0.99,6.15656812290274e-05,1.0,10,1024,,0.45476926951073404,PRUNED
58,58,6.0,2022-03-07 15:24:55.626723,2022-03-07 15:25:22.595028,0 days 00:00:26.968305,,64,0.2,0.004607654843257071,1.0,0.99,1.4204177267945296e-05,1.0,5,1024,,0.9290631260706279,PRUNED
59,59,6.333333333333333,2022-03-07 15:25:22.595028,2022-03-07 15:26:07.461601,0 days 00:00:44.866573,,32,0.3,0.008644922249429123,0.99,0.995,9.52729346992621e-05,0.7,10,256,,0.2186766565919277,PRUNED
60,60,-5.0,2022-03-07 15:26:07.461601,2022-03-07 15:26:53.200149,0 days 00:00:45.738548,,512,0.1,0.004017852265299418,0.9,0.999,0.00018057649656765313,2.0,1,64,,0.03367169352746101,COMPLETE
61,61,5.0,2022-03-07 15:26:53.200149,2022-03-07 15:27:25.835567,0 days 00:00:32.635418,,64,0.2,0.006162078122166903,1.0,0.99,5.56166046460668e-05,1.0,10,1024,,0.3740165558550367,PRUNED
62,62,7.0,2022-03-07 15:27:25.835567,2022-03-07 15:27:58.183176,0 days 00:00:32.347609,,64,0.2,0.0071425895757844474,1.0,0.99,3.0900269001121656e-05,1.0,10,1024,,0.46018677103137606,PRUNED
63,63,9.0,2022-03-07 15:27:59.276926,2022-03-07 15:28:28.028924,0 days 00:00:28.751998,,256,0.2,0.0030667159861525765,0.92,0.995,0.00011615677861895233,1.0,10,128,,0.2844716266795717,PRUNED
64,64,-1.0,2022-03-07 15:28:28.028924,2022-03-07 15:28:54.826238,0 days 00:00:26.797314,,128,0.2,0.0053909585858797375,1.0,0.999,3.769297929517129e-05,5.0,10,2048,,0.39227863587548195,PRUNED
65,65,7.666666666666667,2022-03-07 15:28:54.826238,2022-03-07 15:30:03.712529,0 days 00:01:08.886291,,64,0.2,0.001445700308179235,1.0,0.99,7.426217157979553e-05,0.9,10,512,,0.33214345159998426,COMPLETE
66,66,7.666666666666667,2022-03-07 15:30:03.712529,2022-03-07 15:30:36.857982,0 days 00:00:33.145453,,64,0.2,0.0014573855012200772,1.0,0.99,0.0009701362803297738,0.9,10,512,,0.5759225193508939,PRUNED
67,67,2.3333333333333335,2022-03-07 15:30:36.857982,2022-03-07 15:31:09.850018,0 days 00:00:32.992036,,64,0.2,0.0010960483635457194,1.0,0.99,6.969190724901011e-05,0.9,10,512,,0.9956086644896579,PRUNED
68,68,15.666666666666666,2022-03-07 15:31:09.850018,2022-03-07 15:32:05.792217,0 days 00:00:55.942199,,64,0.1,0.0026399483195101627,1.0,0.99,8.628371735840552e-05,0.9,5,512,,0.41842082896709737,COMPLETE
69,69,5.333333333333333,2022-03-07 15:32:05.792217,2022-03-07 15:32:32.881327,0 days 00:00:27.089110,,64,0.1,0.0019908733124805052,0.99,0.99,0.00015067785621303233,0.9,5,512,,0.5148199884326685,PRUNED
70,70,4.0,2022-03-07 15:32:32.881327,2022-03-07 15:32:55.440236,0 days 00:00:22.558909,,512,0.1,0.0027307012919829056,1.0,0.9999,9.812773854337265e-05,0.9,5,512,,0.4223512509656347,PRUNED
71,71,8.0,2022-03-07 15:32:55.440236,2022-03-07 15:33:22.610238,0 days 00:00:27.170002,,64,0.1,0.004107616095551196,1.0,0.99,8.726107400575858e-05,0.9,5,512,,0.34760043660692475,PRUNED
72,72,3.6666666666666665,2022-03-07 15:33:22.610238,2022-03-07 15:33:49.601956,0 days 00:00:26.991718,,64,0.1,0.0034186951382324323,1.0,0.99,1.0110284603840068e-05,0.9,5,512,,0.2535060917855812,PRUNED
73,73,3.0,2022-03-07 15:33:50.742583,2022-03-07 15:34:36.245338,0 days 00:00:45.502755,,64,0.4,0.0024801619189793868,1.0,0.99,0.00012899320016663334,0.9,20,512,,0.4623242962597,PRUNED
74,74,2.0,2022-03-07 15:34:36.245338,2022-03-07 15:35:03.367423,0 days 00:00:27.122085,,64,0.2,0.0037755906244376783,0.98,0.99,5.540363225022354e-05,0.3,5,1024,,0.1391593440664884,PRUNED
75,75,-6.0,2022-03-07 15:35:03.367423,2022-03-07 15:36:32.451047,0 days 00:01:29.083624,,32,0.1,0.004872269925388973,1.0,0.95,8.12594061855292e-05,0.7,10,128,,0.33014236929992746,COMPLETE
76,76,5.666666666666667,2022-03-07 15:36:32.451047,2022-03-07 15:37:06.244065,0 days 00:00:33.793018,,256,0.2,0.0006668739321547294,0.9,0.999,6.67623754830208e-05,0.9,10,64,,0.6349297807304871,PRUNED
77,77,0.0,2022-03-07 15:37:06.244065,2022-03-07 15:37:52.375049,0 days 00:00:46.130984,,512,0.2,0.000942322664194135,0.8,0.99,1.3074726761881558e-05,1.0,5,1024,,0.5318325844621876,COMPLETE
78,78,-2.0,2022-03-07 15:37:52.390675,2022-03-07 15:38:25.863735,0 days 00:00:33.473060,,64,0.3,0.0020417197482077176,0.99,0.9,1.4674179721155098e-05,0.3,10,256,,0.4217447199410668,PRUNED
79,79,11.333333333333334,2022-03-07 15:38:25.863735,2022-03-07 15:39:10.305124,0 days 00:00:44.441389,,256,0.1,0.0015983359290632595,1.0,0.99,1.661609378075425e-05,5.0,1,128,,0.9600520438318411,COMPLETE
80,80,10.666666666666666,2022-03-07 15:39:10.305124,2022-03-07 15:39:32.207861,0 days 00:00:21.902737,,256,0.1,0.0016329273775188753,1.0,0.999,1.6121786611480925e-05,5.0,1,128,,0.9595302899760368,PRUNED
81,81,0.6666666666666666,2022-03-07 15:39:32.207861,2022-03-07 15:39:54.102292,0 days 00:00:21.894431,,256,0.1,0.0013055688383212976,1.0,0.99,2.0738544076685452e-05,5.0,1,128,,0.8128577361910738,PRUNED
82,82,-0.3333333333333333,2022-03-07 15:39:54.102292,2022-03-07 15:40:15.804131,0 days 00:00:21.701839,,256,0.1,0.0012130118079838675,1.0,0.99,2.3823993872127262e-05,5.0,1,128,,0.8655866733260833,PRUNED
83,83,4.0,2022-03-07 15:40:17.022883,2022-03-07 15:40:38.810234,0 days 00:00:21.787351,,256,0.1,0.0015194874378909222,1.0,0.99,1.6932483424851978e-05,5.0,1,128,,0.9004105429835417,PRUNED
84,84,4.0,2022-03-07 15:40:38.810234,2022-03-07 15:42:09.046512,0 days 00:01:30.236278,,32,0.2,0.0018346825808877064,0.99,0.99,1.1545018686589721e-05,0.7,10,512,,0.6945932967831202,COMPLETE
85,85,3.6666666666666665,2022-03-07 15:42:09.046512,2022-03-07 15:42:31.686276,0 days 00:00:22.639764,,256,0.1,0.002270058308237785,1.0,0.99,7.216960501352246e-05,2.0,1,64,,0.9266381898994686,PRUNED
86,86,5.666666666666667,2022-03-07 15:42:31.686276,2022-03-07 15:42:58.181594,0 days 00:00:26.495318,,512,0.2,0.0032597454082305554,0.9,0.999,6.141067337087956e-05,0.9,20,1024,,0.9697202616313583,PRUNED
87,87,-1.3333333333333333,2022-03-07 15:42:58.181594,2022-03-07 15:43:26.108257,0 days 00:00:27.926663,,256,0.4,0.002860381580948249,0.92,0.99,1.8883077216780047e-05,1.0,10,128,,0.999341092398184,PRUNED
88,88,-0.6666666666666666,2022-03-07 15:43:26.108257,2022-03-07 15:43:52.783937,0 days 00:00:26.675680,,64,0.2,0.0009004198519110973,1.0,0.9999,0.00010622058357204612,0.3,5,1024,,0.7634865916681955,PRUNED
89,89,4.666666666666667,2022-03-07 15:43:52.783937,2022-03-07 15:44:19.516721,0 days 00:00:26.732784,,128,0.1,0.009019821026515872,0.95,0.995,4.808752618495966e-05,0.5,10,2048,,0.18591697828818715,PRUNED
90,90,-0.3333333333333333,2022-03-07 15:44:19.516721,2022-03-07 15:44:47.895447,0 days 00:00:28.378726,,512,0.2,0.0076523254779270605,0.99,0.95,3.610821675162572e-05,0.9,10,128,,0.36606341564824324,PRUNED
91,91,19.0,2022-03-07 15:44:47.895447,2022-03-07 15:45:56.579225,0 days 00:01:08.683778,,256,0.2,0.0069192743551725385,0.95,0.995,4.390818198971143e-05,0.5,10,64,,0.31243863447037923,COMPLETE
92,92,0.3333333333333333,2022-03-07 15:45:56.579225,2022-03-07 15:46:30.474261,0 days 00:00:33.895036,,256,0.2,0.006830853947172972,0.98,0.995,4.235923003568525e-05,0.5,10,64,,0.27132355827963495,PRUNED
93,93,8.333333333333334,2022-03-07 15:46:31.755513,2022-03-07 15:47:05.636740,0 days 00:00:33.881227,,256,0.2,0.009300046977653032,0.95,0.995,2.7148993885763598e-05,0.5,10,64,,0.3047843632471632,PRUNED
94,94,4.666666666666667,2022-03-07 15:47:05.636740,2022-03-07 15:47:43.800272,0 days 00:00:38.163532,,256,0.2,0.0008023937641522942,1.0,0.99,5.109488684933718e-05,0.7,10,64,,0.48593109382366717,PRUNED
95,95,10.0,2022-03-07 15:47:43.800272,2022-03-07 15:48:40.273116,0 days 00:00:56.472844,,32,0.2,0.007882275129899474,0.95,0.995,8.273351178539802e-05,0.5,10,64,,0.9391988161892623,PRUNED
96,96,2.0,2022-03-07 15:48:40.273116,2022-03-07 15:49:10.656775,0 days 00:00:30.383659,,256,0.3,0.006261981396240529,0.95,0.995,2.966460742392006e-05,0.5,5,2048,,0.401747821908869,PRUNED
97,97,2.3333333333333335,2022-03-07 15:49:10.656775,2022-03-07 15:49:43.845363,0 days 00:00:33.188588,,512,0.2,0.005124120268064453,0.8,0.999,5.697638361508102e-05,1.0,10,1024,,0.34506300327233275,PRUNED
98,98,-1.3333333333333333,2022-03-07 15:49:43.845363,2022-03-07 15:50:15.575952,0 days 00:00:31.730589,,128,0.2,0.001071499282098231,0.95,0.995,3.513805751477068e-05,0.5,1,512,,0.10769316152486368,PRUNED
99,99,3.6666666666666665,2022-03-07 15:50:15.575952,2022-03-07 15:50:52.925049,0 days 00:00:37.349097,,256,0.1,0.009827952434466497,0.9,0.995,4.322204936053083e-05,0.5,10,128,,0.47852483806665463,PRUNED
100,100,11.666666666666666,2022-03-07 15:50:52.925049,2022-03-07 15:51:51.419581,0 days 00:00:58.494532,,32,0.2,0.0071171735781459895,0.99,0.999,2.2368263905172224e-05,5.0,10,256,,0.22475797292421767,PRUNED
101,101,9.333333333333334,2022-03-07 15:51:51.419581,2022-03-07 15:52:32.876066,0 days 00:00:41.456485,,64,0.2,0.005746163068348346,1.0,0.99,6.207072511623574e-05,0.5,10,1024,,0.3242154935583529,PRUNED
102,102,11.0,2022-03-07 15:52:32.876066,2022-03-07 15:53:15.597855,0 days 00:00:42.721789,,64,0.2,0.004088485885218652,0.95,0.9,9.200290946456037e-05,0.9,10,64,,0.37573978456999746,PRUNED
103,103,-2.0,2022-03-07 15:53:17.191606,2022-03-07 15:53:46.794291,0 days 00:00:29.602685,,512,0.2,0.0043731176289019975,1.0,0.99,7.369129387088342e-05,1.0,10,512,,0.43363061010263804,PRUNED
104,104,4.666666666666667,2022-03-07 15:53:46.794291,2022-03-07 15:54:21.763731,0 days 00:00:34.969440,,128,0.2,0.008324682865617597,1.0,0.995,5.153722292933468e-05,0.3,10,128,,0.26507731054925,PRUNED
105,105,8.333333333333334,2022-03-07 15:54:21.763731,2022-03-07 15:54:50.636354,0 days 00:00:28.872623,,256,0.2,0.006317069216760079,0.99,0.99,1.2049390362603627e-05,2.0,5,2048,,0.9079137671256617,PRUNED
106,106,11.333333333333334,2022-03-07 15:54:50.636354,2022-03-07 15:55:31.641832,0 days 00:00:41.005478,,64,0.2,0.0047889352674993346,0.9,0.99,0.00012374891990586185,0.7,10,1024,,0.2015882358526185,PRUNED
107,107,0.6666666666666666,2022-03-07 15:55:31.641832,2022-03-07 15:56:33.924582,0 days 00:01:02.282750,,256,0.1,0.007421694814035883,0.92,0.999,6.43201316973203e-05,0.9,20,64,,0.28820046212724865,PRUNED
