,number,value,datetime_start,datetime_complete,duration,params_activation_fn,params_batch_size,params_clip_range,params_ent_coef,params_gae_lambda,params_gamma,params_learning_rate,params_max_grad_norm,params_n_epochs,params_n_steps,params_net_arch,params_vf_coef,state
0,0,398.3333333333333,2022-03-02 23:22:33.492218,2022-03-02 23:23:39.762020,0 days 00:01:06.269802,tanh,512,0.3,0.001842532906654376,0.92,0.9,0.00016374262778877442,0.7,10,128,medium,0.12813804644322935,COMPLETE
1,1,398.6666666666667,2022-03-02 23:24:26.857762,2022-03-02 23:26:14.764345,0 days 00:01:47.906583,tanh,256,0.4,0.00045024960847664977,0.99,0.9999,0.00018924600438931997,0.5,10,1024,small,0.5332666098119483,COMPLETE
2,2,401.6666666666667,2022-03-02 23:24:26.857762,2022-03-02 23:31:30.838214,0 days 00:07:03.980452,relu,32,0.2,0.0017657578374456453,0.9,0.999,5.1466180154270406e-05,5.0,20,512,medium,0.509355207000456,COMPLETE
3,3,404.0,2022-03-02 23:24:26.857762,2022-03-02 23:26:09.912494,0 days 00:01:43.054732,relu,32,0.2,0.0007314175918750615,0.8,0.95,6.34563284153015e-05,2.0,1,2048,small,0.13401280269019566,COMPLETE
4,4,3.0,2022-03-02 23:26:09.912494,2022-03-02 23:28:17.545124,0 days 00:02:07.632630,tanh,512,0.1,0.0002610638047622559,0.92,0.999,0.00031072185374312857,0.3,20,256,medium,0.6383016671363749,COMPLETE
5,5,-11.0,2022-03-02 23:26:14.764345,2022-03-02 23:28:22.426701,0 days 00:02:07.662356,tanh,512,0.2,0.006904902999809534,0.92,0.9999,0.0002463874553589043,1.0,20,256,medium,0.050511580026307956,COMPLETE
6,6,5.0,2022-03-02 23:28:17.545124,2022-03-02 23:31:05.928889,0 days 00:02:48.383765,relu,32,0.1,0.0002563236040622012,0.99,0.999,0.00022838449903940004,0.5,5,64,medium,0.9176235777514007,COMPLETE
7,7,-1.3333333333333333,2022-03-02 23:28:22.426701,2022-03-02 23:29:53.396754,0 days 00:01:30.970053,relu,32,0.2,0.0017535473433818222,0.8,0.95,1.7697484667562848e-05,2.0,1,2048,small,0.9000280407066716,COMPLETE
8,8,-6.0,2022-03-02 23:29:53.396754,2022-03-02 23:30:39.707443,0 days 00:00:46.310689,relu,32,0.2,0.00010308842137689465,0.8,0.99,3.2245858968038855e-05,2.0,1,512,small,0.2542896279626913,PRUNED
9,9,4.333333333333333,2022-03-02 23:30:39.707443,2022-03-02 23:31:28.002218,0 days 00:00:48.294775,relu,128,0.4,0.0065122296398845494,0.95,0.95,0.0009667484809195379,5.0,5,2048,small,0.37003639036637503,PRUNED
10,10,2.3333333333333335,2022-03-02 23:31:05.928889,2022-03-02 23:31:55.625165,0 days 00:00:49.696276,relu,64,0.4,0.0055994788421744116,0.95,0.95,0.0009826966492074759,0.9,1,2048,small,0.33653693020966874,PRUNED
11,11,-0.6666666666666666,2022-03-02 23:31:28.017844,2022-03-02 23:32:19.962538,0 days 00:00:51.944694,relu,64,0.3,0.0006106529466525945,1.0,0.995,7.268281392811517e-05,0.9,1,2048,small,0.36272287137390935,PRUNED
12,12,806.6666666666666,2022-03-02 23:31:30.853840,2022-03-02 23:33:06.843559,0 days 00:01:35.989719,relu,64,0.3,0.0009930438087233262,1.0,0.995,1.131483392453254e-05,0.9,1,2048,small,0.27572957457179803,COMPLETE
13,13,2.0,2022-03-02 23:31:55.625165,2022-03-02 23:39:00.906513,0 days 00:07:05.281348,relu,32,0.2,0.000929646308389391,0.9,0.995,5.5973339220882715e-05,5.0,20,512,medium,0.5241722229981904,COMPLETE
14,14,1.0,2022-03-02 23:32:19.962538,2022-03-02 23:35:35.579726,0 days 00:03:15.617188,relu,32,0.2,0.0017280746274970856,0.9,0.999,5.555692564659391e-05,5.0,20,512,medium,0.6771127975191567,PRUNED
15,15,3.0,2022-03-02 23:33:06.843559,2022-03-02 23:33:48.423851,0 days 00:00:41.580292,relu,64,0.3,0.0008800969311906464,0.98,0.995,1.0957215022165812e-05,2.0,1,2048,small,0.17756202468161378,PRUNED
16,16,405.6666666666667,2022-03-02 23:33:48.423851,2022-03-02 23:35:03.106561,0 days 00:01:14.682710,relu,256,0.3,0.0028935629567164944,1.0,0.995,2.9070792261973658e-05,0.9,1,1024,small,0.023422616775238395,COMPLETE
17,17,809.3333333333334,2022-03-02 23:35:03.106561,2022-03-02 23:36:28.136893,0 days 00:01:25.030332,relu,256,0.3,0.002506428238152894,1.0,0.995,2.2902333228446046e-05,0.9,1,1024,small,0.019674077420851754,COMPLETE
18,18,6.0,2022-03-02 23:35:35.579726,2022-03-02 23:36:20.296865,0 days 00:00:44.717139,relu,256,0.3,0.0036231346339040764,1.0,0.995,2.363990245360185e-05,0.9,1,1024,small,0.009412463834863624,PRUNED
19,19,-2.6666666666666665,2022-03-02 23:36:20.296865,2022-03-02 23:37:51.974758,0 days 00:01:31.677893,relu,256,0.3,0.0030023211767714847,1.0,0.995,1.0052013603562524e-05,0.9,1,1024,small,0.2581870975731032,COMPLETE
20,20,403.6666666666667,2022-03-02 23:36:28.136893,2022-03-02 23:37:24.920747,0 days 00:00:56.783854,tanh,128,0.3,0.0033815696177043643,1.0,0.995,1.0534842692223647e-05,0.9,5,64,small,0.26368233035143746,PRUNED
21,21,409.6666666666667,2022-03-02 23:37:24.920747,2022-03-02 23:38:21.422328,0 days 00:00:56.501581,relu,256,0.3,0.0011388041438993393,1.0,0.9,1.6741938491195338e-05,0.3,10,128,small,0.22740977197548484,PRUNED
22,22,399.6666666666667,2022-03-02 23:37:51.974758,2022-03-02 23:38:59.281512,0 days 00:01:07.306754,relu,64,0.3,0.0011200379745303377,0.98,0.9,1.7536772836765815e-05,1.0,10,128,small,0.4193911708031155,PRUNED
23,23,2.3333333333333335,2022-03-02 23:38:21.422328,2022-03-02 23:39:06.230520,0 days 00:00:44.808192,relu,256,0.3,0.0029927985207928625,1.0,0.995,2.9890522863458632e-05,0.9,1,1024,small,0.07817905015631171,PRUNED
24,24,2.3333333333333335,2022-03-02 23:38:59.281512,2022-03-02 23:39:56.446272,0 days 00:00:57.164760,relu,256,0.3,0.0026870462420980146,1.0,0.995,3.485881851816941e-05,0.9,1,1024,small,0.07077608728799781,PRUNED
25,25,405.3333333333333,2022-03-02 23:39:00.906513,2022-03-02 23:39:56.696274,0 days 00:00:55.789761,relu,256,0.3,0.0026676104546163896,1.0,0.995,3.4517086456378476e-05,0.9,1,1024,small,0.07113178820841116,PRUNED
26,26,3.3333333333333335,2022-03-02 23:39:06.230520,2022-03-02 23:39:59.515269,0 days 00:00:53.284749,relu,256,0.3,0.004371976578606831,1.0,0.99,3.4172679276861455e-05,0.9,1,1024,small,0.003200059083985976,PRUNED
27,27,-7.0,2022-03-02 23:41:31.691122,2022-03-02 23:43:24.266824,0 days 00:01:52.575702,tanh,64,0.1,0.00829629184030212,1.0,0.995,0.0001079754451114542,0.7,1,1024,small,0.18195367594781986,COMPLETE
28,28,3.3333333333333335,2022-03-02 23:41:31.691122,2022-03-02 23:42:26.189840,0 days 00:00:54.498718,tanh,64,0.1,0.008613557723092123,1.0,0.995,0.00012287876813998425,0.7,1,1024,small,0.15887658703656077,PRUNED
29,29,0.3333333333333333,2022-03-02 23:41:31.691122,2022-03-02 23:42:25.486716,0 days 00:00:53.795594,tanh,64,0.1,0.0014255190639671969,1.0,0.995,0.00011440373405064004,0.7,1,1024,small,0.17067576118860722,PRUNED
30,30,1202.0,2022-03-02 23:42:25.486716,2022-03-02 23:44:15.193066,0 days 00:01:49.706350,relu,128,0.3,0.008640131402340243,1.0,0.995,1.5013745993749679e-05,0.9,1,256,small,0.8097123669109118,COMPLETE
31,31,400.3333333333333,2022-03-02 23:42:26.189840,2022-03-02 23:43:25.930893,0 days 00:00:59.741053,relu,128,0.3,0.000520234475543193,0.95,0.99,1.3870132773159184e-05,0.9,5,256,small,0.7789278819543555,PRUNED
32,32,404.0,2022-03-02 23:43:24.266824,2022-03-02 23:45:36.100971,0 days 00:02:11.834147,relu,128,0.3,0.0022282494906651082,0.99,0.99,1.4626504358679202e-05,0.9,5,64,small,0.44952733234309844,COMPLETE
33,33,2.6666666666666665,2022-03-02 23:43:25.930893,2022-03-02 23:45:14.016121,0 days 00:01:48.085228,relu,512,0.3,0.0007139983443173047,0.8,0.95,2.3234922217348685e-05,2.0,1,2048,small,0.11972319512696161,COMPLETE
34,34,1.0,2022-03-02 23:44:15.193066,2022-03-02 23:45:07.773613,0 days 00:00:52.580547,relu,128,0.3,0.004985433742434855,0.99,0.9999,2.0036678652248018e-05,0.9,1,256,small,0.6088268223013025,PRUNED
35,35,1.0,2022-03-02 23:45:07.773613,2022-03-02 23:46:09.830713,0 days 00:01:02.057100,relu,128,0.3,0.00037437001031815227,1.0,0.995,1.3239760757206998e-05,0.5,10,256,small,0.7482852936635856,PRUNED
36,36,2.3333333333333335,2022-03-02 23:45:14.016121,2022-03-02 23:46:16.136011,0 days 00:01:02.119890,relu,128,0.4,0.0021406053871942062,1.0,0.995,1.415198968626102e-05,0.5,10,256,small,0.30982196552853636,PRUNED
37,37,1.3333333333333333,2022-03-02 23:45:36.100971,2022-03-02 23:46:32.472264,0 days 00:00:56.371293,relu,256,0.4,0.0003463003097624729,0.92,0.995,2.5233468483065808e-05,0.5,10,256,small,0.8374135151783868,PRUNED
38,38,-8.0,2022-03-02 23:46:09.846338,2022-03-02 23:47:01.190610,0 days 00:00:51.344272,relu,256,0.4,0.001373196909759932,0.92,0.9,4.265136145640196e-05,0.3,1,256,medium,0.8147644322212215,PRUNED
39,39,-0.3333333333333333,2022-03-02 23:46:16.136011,2022-03-02 23:47:08.747096,0 days 00:00:52.611085,relu,256,0.3,0.001425769220233235,0.92,0.9999,2.4842835941648165e-05,0.3,1,128,medium,0.830412511079792,PRUNED
40,40,7.666666666666667,2022-03-02 23:46:32.472264,2022-03-02 23:47:25.495508,0 days 00:00:53.023244,tanh,512,0.3,0.0014548153550154694,0.98,0.9999,4.391761285248676e-05,0.3,1,128,medium,0.9565404182860799,PRUNED
41,41,-2.6666666666666665,2022-03-02 23:47:01.190610,2022-03-02 23:47:56.023259,0 days 00:00:54.832649,tanh,512,0.3,0.004222592832449171,0.98,0.9999,7.670645906549e-05,1.0,1,128,medium,0.44942549696081624,PRUNED
42,42,402.6666666666667,2022-03-02 23:47:08.747096,2022-03-02 23:48:07.046530,0 days 00:00:58.299434,tanh,512,0.3,0.004319371465749315,0.98,0.999,7.511497961132065e-05,1.0,1,64,medium,0.9795997718120739,PRUNED
43,43,6.666666666666667,2022-03-02 23:47:25.495508,2022-03-02 23:48:31.101280,0 days 00:01:05.605772,relu,128,0.3,0.0022732621826195053,0.9,0.99,1.3898211800252976e-05,0.9,5,64,small,0.4690637289478331,PRUNED
44,44,9.333333333333334,2022-03-02 23:47:56.023259,2022-03-02 23:48:56.983821,0 days 00:01:00.960562,relu,128,0.3,0.002213809842671119,0.99,0.99,1.4083727944163597e-05,0.9,5,64,small,0.5942801998316819,PRUNED
45,45,1.3333333333333333,2022-03-02 23:48:07.046530,2022-03-02 23:50:15.169148,0 days 00:02:08.122618,relu,32,0.2,0.0007403948013255787,0.8,0.95,0.0003746355230159633,2.0,20,2048,small,0.12147078616162343,PRUNED
46,46,398.3333333333333,2022-03-02 23:48:31.101280,2022-03-02 23:50:39.807840,0 days 00:02:08.706560,relu,32,0.2,0.0007613876901875266,0.8,0.95,0.0003518775115228831,2.0,20,2048,small,0.11328486759304107,PRUNED
47,47,2.0,2022-03-02 23:48:56.983821,2022-03-02 23:49:56.884870,0 days 00:00:59.901049,relu,128,0.3,0.006651541705966528,0.99,0.99,0.00035293463879729783,0.9,5,64,small,0.5722616213448727,PRUNED
48,48,411.6666666666667,2022-03-02 23:49:56.884870,2022-03-02 23:51:07.670168,0 days 00:01:10.785298,relu,128,0.2,0.0018243413635396918,0.99,0.995,1.968067016926896e-05,0.9,20,2048,small,0.4063003908840927,PRUNED
49,49,409.3333333333333,2022-03-02 23:50:15.169148,2022-03-02 23:51:11.786539,0 days 00:00:56.617391,relu,128,0.3,0.009622019800315285,0.99,0.995,1.969839358474218e-05,0.9,5,512,small,0.3235494171213346,PRUNED
50,50,3.6666666666666665,2022-03-02 23:50:39.807840,2022-03-02 23:51:44.597698,0 days 00:01:04.789858,relu,128,0.3,0.00018132781212104398,0.99,0.995,1.949437495842803e-05,0.9,5,64,small,0.6840187231828501,PRUNED
51,51,403.6666666666667,2022-03-02 23:51:07.685793,2022-03-02 23:52:06.054603,0 days 00:00:58.368810,relu,32,0.2,0.00047112919488058864,0.8,0.95,4.4630432291402014e-05,5.0,1,512,small,0.029531065233735054,PRUNED
52,52,407.0,2022-03-02 23:51:11.786539,2022-03-02 23:53:26.692229,0 days 00:02:14.905690,relu,64,0.3,0.00015677973103379498,1.0,0.999,2.8276623842037925e-05,5.0,5,64,small,0.7130211151258948,COMPLETE
53,53,0.0,2022-03-02 23:51:44.597698,2022-03-02 23:53:44.528927,0 days 00:01:59.931229,relu,32,0.2,0.0010286207880137333,0.8,0.95,1.2040221334568329e-05,5.0,1,2048,small,0.039744841957249644,COMPLETE
54,54,402.6666666666667,2022-03-02 23:52:06.054603,2022-03-02 23:53:02.803920,0 days 00:00:56.749317,relu,32,0.2,0.0009910753669566258,0.95,0.999,1.2141142545772384e-05,2.0,1,2048,small,0.2044029506459929,PRUNED
55,55,2.0,2022-03-02 23:53:02.803920,2022-03-02 23:53:58.679381,0 days 00:00:55.875461,relu,64,0.1,0.005342416378346684,1.0,0.95,0.00014844998666710516,0.9,1,2048,small,0.2733959629277608,PRUNED
56,56,397.0,2022-03-02 23:53:26.692229,2022-03-02 23:54:22.613510,0 days 00:00:55.921281,relu,64,0.1,0.00010439848085908733,1.0,0.999,0.0001548787080655341,5.0,1,2048,small,0.8991773502270183,PRUNED
57,57,405.0,2022-03-02 23:53:44.528927,2022-03-02 23:54:38.964953,0 days 00:00:54.436026,relu,64,0.1,0.00014817908654637496,1.0,0.999,2.8828292030133747e-05,5.0,1,1024,small,0.8755797478581677,PRUNED
58,58,12.666666666666666,2022-03-02 23:53:58.695005,2022-03-02 23:54:51.941899,0 days 00:00:53.246894,relu,64,0.3,0.00015175215038894978,1.0,0.999,2.541189182933401e-05,5.0,1,1024,small,0.8878551334542479,PRUNED
59,59,6.666666666666667,2022-03-02 23:54:22.613510,2022-03-02 23:55:15.304179,0 days 00:00:52.690669,relu,64,0.3,0.00015104545620772572,1.0,0.999,2.6951803276175702e-05,5.0,1,1024,small,0.09019788496184891,PRUNED
60,60,400.3333333333333,2022-03-02 23:54:38.964953,2022-03-02 23:55:42.623806,0 days 00:01:03.658853,relu,64,0.3,0.003444149885803586,1.0,0.999,1.6565417903942515e-05,0.9,5,64,small,0.6642951852337444,PRUNED
61,61,4.333333333333333,2022-03-02 23:54:51.957523,2022-03-02 23:55:42.670682,0 days 00:00:50.713159,relu,256,0.3,0.00025660623587652983,1.0,0.9,6.190597954279814e-05,2.0,1,1024,small,0.705970678976006,PRUNED
62,62,406.0,2022-03-02 23:55:15.319804,2022-03-02 23:56:06.118687,0 days 00:00:50.798883,relu,256,0.4,0.00026713978049908036,0.9,0.9,6.246303479499154e-05,2.0,1,256,small,0.7161710356281642,PRUNED
63,63,-3.3333333333333335,2022-03-02 23:55:42.623806,2022-03-02 23:56:47.227311,0 days 00:01:04.603505,relu,256,0.3,0.0005776534169295444,1.0,0.99,1.6909206193589987e-05,0.9,5,64,small,0.7388483542164056,PRUNED
64,64,409.3333333333333,2022-03-02 23:55:42.670682,2022-03-02 23:56:47.055435,0 days 00:01:04.384753,relu,256,0.3,0.0025198608326869893,0.9,0.99,2.2194493786643496e-05,0.9,5,64,small,0.5469892169449424,PRUNED
65,65,800.3333333333334,2022-03-02 23:56:06.118687,2022-03-02 23:56:56.411949,0 days 00:00:50.293262,relu,256,0.3,0.0027530063314600284,1.0,0.99,1.6104406244561513e-05,0.9,5,64,small,0.05498022119387169,PRUNED
66,66,408.0,2022-03-02 23:59:51.612717,2022-03-03 00:01:00.161103,0 days 00:01:08.548386,relu,32,0.3,0.0016624942278523046,0.95,0.995,3.9822100822841794e-05,0.7,5,2048,small,0.3851103172640301,PRUNED
67,67,7.0,2022-03-02 23:59:51.612717,2022-03-03 00:02:25.591335,0 days 00:02:33.978618,relu,32,0.3,0.0011750117789549783,0.95,0.995,1.0317005862489855e-05,0.7,5,2048,small,0.14223098834207934,COMPLETE
68,68,398.3333333333333,2022-03-02 23:59:51.612717,2022-03-03 00:01:00.067352,0 days 00:01:08.454635,relu,32,0.3,0.0017010236416433973,0.95,0.995,1.006875645172612e-05,0.7,5,2048,small,0.37017139943892385,PRUNED
69,69,800.3333333333334,2022-03-03 00:01:00.067352,2022-03-03 00:02:15.277609,0 days 00:01:15.210257,relu,64,0.2,0.007519255408180996,0.8,0.995,3.787897902037227e-05,0.9,10,1024,small,0.21958523100016994,PRUNED
70,70,401.0,2022-03-03 00:01:00.161103,2022-03-03 00:02:15.308863,0 days 00:01:15.147760,relu,64,0.2,0.003813113718570212,0.8,0.995,1.1878162564452814e-05,0.9,10,1024,small,0.49336743930207905,PRUNED
71,71,406.6666666666667,2022-03-03 00:02:15.277609,2022-03-03 00:03:02.908760,0 days 00:00:47.631151,tanh,128,0.3,0.00038376072322574787,1.0,0.995,1.1763292273981304e-05,0.9,1,256,small,0.1463906142893246,PRUNED
72,72,404.6666666666667,2022-03-03 00:02:15.308863,2022-03-03 00:03:44.616831,0 days 00:01:29.307968,tanh,128,0.3,0.001153869603930569,1.0,0.995,2.923330790999925e-05,1.0,1,256,medium,0.02210571460247282,COMPLETE
73,73,801.0,2022-03-03 00:02:25.591335,2022-03-03 00:05:34.861887,0 days 00:03:09.270552,relu,32,0.2,0.002056608252523159,0.9,0.999,3.2827927546111426e-05,5.0,20,512,medium,0.014596260054297181,PRUNED
74,74,-7.333333333333333,2022-03-03 00:03:02.908760,2022-03-03 00:10:20.442806,0 days 00:07:17.534046,relu,32,0.2,0.0012149864844453215,0.9,0.999,4.926526334552466e-05,5.0,20,512,medium,0.026304789236608242,COMPLETE
75,75,7.0,2022-03-03 00:03:44.616831,2022-03-03 00:04:22.371394,0 days 00:00:37.754563,tanh,128,0.3,0.000865263443089618,1.0,0.995,3.1840179336006034e-05,1.0,1,256,medium,0.002107496211193202,PRUNED
76,76,402.3333333333333,2022-03-03 00:04:22.371394,2022-03-03 00:05:01.721570,0 days 00:00:39.350176,tanh,128,0.3,0.0020537969711729577,1.0,0.995,9.240406424557241e-05,1.0,1,256,medium,0.08648129531022178,PRUNED
77,77,-3.3333333333333335,2022-03-03 00:05:01.721570,2022-03-03 00:05:46.294571,0 days 00:00:44.573001,tanh,128,0.3,0.0012385494453526482,1.0,0.995,4.8970513000085134e-05,1.0,1,256,medium,0.03290552301697922,PRUNED
78,78,400.0,2022-03-03 00:05:34.861887,2022-03-03 00:06:24.143877,0 days 00:00:49.281990,tanh,128,0.3,0.0012626753862404645,1.0,0.995,4.957825786492093e-05,1.0,1,256,medium,0.04892717568886182,PRUNED
79,79,407.0,2022-03-03 00:05:46.294571,2022-03-03 00:06:36.718510,0 days 00:00:50.423939,tanh,128,0.3,0.003087418422043315,0.92,0.95,2.2448484646628398e-05,0.5,1,64,medium,0.10225241420556325,PRUNED
80,80,801.0,2022-03-03 00:06:24.143877,2022-03-03 00:08:03.304431,0 days 00:01:39.160554,tanh,512,0.4,0.0008348841995659707,0.92,0.95,2.1757702910673208e-05,0.5,1,64,medium,0.2974754970576771,COMPLETE
81,81,398.3333333333333,2022-03-03 00:06:36.718510,2022-03-03 00:07:24.220912,0 days 00:00:47.502402,relu,512,0.3,0.006139399775471657,0.99,0.995,1.551933659429427e-05,0.9,1,128,small,0.6337371645584794,PRUNED
82,82,396.3333333333333,2022-03-03 00:07:24.220912,2022-03-03 00:08:09.516105,0 days 00:00:45.295193,relu,256,0.3,0.0006537228947644853,1.0,0.9999,0.00022500609993674544,0.3,1,64,small,0.7710107061824265,PRUNED
83,83,6.0,2022-03-03 00:08:03.304431,2022-03-03 00:08:53.106027,0 days 00:00:49.801596,tanh,512,0.4,0.0006450687166522833,0.92,0.95,2.8522117758056956e-05,0.5,1,64,medium,0.299455051554953,PRUNED
84,84,803.6666666666666,2022-03-03 00:08:09.516105,2022-03-03 00:09:00.599549,0 days 00:00:51.083444,tanh,512,0.4,0.0008581314083581574,0.92,0.95,1.8558892612744675e-05,0.5,1,64,medium,0.2809781104071152,PRUNED
85,85,405.0,2022-03-03 00:08:53.106027,2022-03-03 00:10:35.702129,0 days 00:01:42.596102,tanh,512,0.4,0.0008602625252646909,0.92,0.95,2.161232694283309e-05,0.5,1,64,medium,0.34618463352855794,COMPLETE
86,86,404.3333333333333,2022-03-03 00:09:00.615173,2022-03-03 00:09:52.995725,0 days 00:00:52.380552,tanh,512,0.4,0.0007617138065878702,0.92,0.95,2.1969089895156893e-05,0.5,1,64,medium,0.24231733336021558,PRUNED
87,87,-3.0,2022-03-03 00:09:52.995725,2022-03-03 00:10:40.303946,0 days 00:00:47.308221,tanh,128,0.4,0.0010758314689519612,1.0,0.95,3.619130848211028e-05,2.0,1,256,medium,0.34554860578256397,PRUNED
88,88,402.6666666666667,2022-03-03 00:10:20.442806,2022-03-03 00:11:14.701541,0 days 00:00:54.258735,tanh,128,0.3,0.0010611809115548872,1.0,0.95,2.129282511198357e-05,2.0,1,256,medium,0.18605090411353317,PRUNED
89,89,802.6666666666666,2022-03-03 00:10:35.702129,2022-03-03 00:11:29.559162,0 days 00:00:53.857033,tanh,512,0.4,0.00102248091649541,0.92,0.95,0.0004688118413584746,0.5,1,1024,medium,0.3461983054671761,PRUNED
90,90,3.6666666666666665,2022-03-03 00:10:40.303946,2022-03-03 00:12:32.410675,0 days 00:01:52.106729,tanh,512,0.4,0.0015565714498955291,0.92,0.95,2.0929910886596953e-05,0.5,1,1024,medium,0.06679190862066178,COMPLETE
91,91,401.6666666666667,2022-03-03 00:11:14.701541,2022-03-03 00:12:08.541094,0 days 00:00:53.839553,tanh,512,0.4,0.0009241164298277098,0.92,0.95,0.0005502888293947391,0.5,1,1024,medium,0.07500400816546811,PRUNED
92,92,406.3333333333333,2022-03-03 00:11:29.559162,2022-03-03 00:12:28.278506,0 days 00:00:58.719344,tanh,512,0.4,0.0015121259890612732,0.92,0.95,2.4922773631680557e-05,0.5,1,64,medium,0.19385837098801464,PRUNED
93,93,411.6666666666667,2022-03-03 00:12:08.541094,2022-03-03 00:13:08.897734,0 days 00:01:00.356640,tanh,512,0.4,0.0005528362189185921,0.92,0.995,1.5124975836992835e-05,0.5,1,64,medium,0.39660451427530297,PRUNED
94,94,799.6666666666666,2022-03-03 00:12:28.278506,2022-03-03 00:13:25.752399,0 days 00:00:57.473893,tanh,512,0.4,0.0005299102743386344,0.98,0.995,1.4608466043003549e-05,0.9,1,64,small,0.43470561524374474,PRUNED
95,95,808.0,2022-03-03 00:12:32.410675,2022-03-03 00:14:23.381053,0 days 00:01:50.970378,relu,64,0.4,0.0005342891755376017,0.98,0.99,1.3132946971991518e-05,0.9,1,64,small,0.43930885587343227,COMPLETE
96,96,5.333333333333333,2022-03-03 00:13:08.897734,2022-03-03 00:14:13.506417,0 days 00:01:04.608683,relu,64,0.3,0.0007916185203106394,0.98,0.99,1.2864081632389253e-05,0.9,5,64,small,0.3031972251235736,PRUNED
97,97,402.0,2022-03-03 00:13:25.752399,2022-03-03 00:14:30.325482,0 days 00:01:04.573083,relu,64,0.3,0.0008347516758482621,0.99,0.99,1.7823915723845214e-05,0.9,5,64,small,0.46964830820505044,PRUNED
98,98,407.3333333333333,2022-03-03 00:14:13.506417,2022-03-03 00:15:04.790681,0 days 00:00:51.284264,relu,256,0.3,0.00479335710535198,0.99,0.995,1.7540843367746768e-05,1.0,1,2048,small,0.5118489213785627,PRUNED
99,99,800.3333333333334,2022-03-03 00:14:23.381053,2022-03-03 00:15:12.235356,0 days 00:00:48.854303,relu,64,0.4,0.0004623415696809963,0.98,0.99,1.8770271911475464e-05,0.9,1,64,small,0.4244266458664151,PRUNED
100,100,402.6666666666667,2022-03-03 00:14:30.325482,2022-03-03 00:15:14.882620,0 days 00:00:44.557138,relu,64,0.4,0.0024922091192412146,0.98,0.99,1.1113607731086797e-05,0.9,1,64,small,0.5301746506202701,PRUNED
